[
  {
    "capacity_type": "unspecified",
    "value_mw": null,
    "state": "not_disclosed",
    "claimant": "Invest Highland",
    "notes": "No MW figure of any kind is given; the listing refers only to 'abundant clean and green power options'.",
    "source_ids": ["src-invest-highland-data-centres"]
  }
]
