[
  {
    "capacity_type": "unspecified",
    "value_mw": null,
    "state": "not_disclosed",
    "claimant": "Invest Highland",
    "notes": "No power or capacity figure of any kind is given; the listing states only that renewable energy options are available.",
    "source_ids": ["src-invest-highland-data-centres"]
  }
]
